{
  "artifact": "sha256:aaaaaaaaaaaaaaaaaaaaaaaaaaaaaaaaaaaaaaaaaaaaaaaaaaaaaaaaaaaaaaaa",
  "inputs_hash": "sha256:bbbbbbbbbbbbbbbbbbbbbbbbbbbbbbbbbbbbbbbbbbbbbbbbbbbbbbbbbbbbbbbb",
  "outputs_hash": "sha256:cccccccccccccccccccccccccccccccccccccccccccccccccccccccccccccccc",
  "caps_used": ["env:HOME"],
  "timestamp": 1738600999,
  "receipt_hash": "sha256:ba1b6579a010096532ca31c2680f7345bda8beb5dd290a427d101e3b584c50e7"
}
